,Rate,Review,Movie_name
0,10,I have NEVER seen such a performance ... ever!,惡棍特工
1,8,Quentin Tarantino's style and Christoph Waltz's menace,惡棍特工
2,10,I can't believe I just now watched this for the first time.,惡棍特工
3,10,Tarantino's best? I think so,惡棍特工
4,10,People seem to be missing the point,惡棍特工
5,7,Pretty good,惡棍特工
6,9,Oh! What a Lovely War...,惡棍特工
7,10,Who the hell is Christoph Waltz?,惡棍特工
8,8,World War II In an Alternate Universe,惡棍特工
9,4,Hitler's Table Talk,惡棍特工
10,3,Schlock and Awe.,惡棍特工
11,8,"Great fun, a real surprise",惡棍特工
12,8,"Not for everyone...but if you like this sort of thing, watch it--it is a lot of fun.",惡棍特工
13,1,A revisionist Holocaust fantasy of far-fetched proportions!,惡棍特工
14,10,No Matter How You Spell It,惡棍特工
15,1,Fiasco,惡棍特工
16,4,A dangerous and irresponsible film from a director who used to be great...,惡棍特工
17,9,A Comedy Of Horrors,惡棍特工
18,1,"""I don't suppose you'll mind if I go out speaking the King's.""",惡棍特工
19,9,Dark but Funny Comic Fantasy,惡棍特工
20,1,This Movie Was A Bad Joke About WWII,惡棍特工
21,2,Exceptionally poor effort at pornographic sadism,惡棍特工
22,1,A failure to fuse different movie genres into one feature.,惡棍特工
23,6,Tarantino and His Italian Critics,惡棍特工
24,8,"Hey, It's Tarantino!",惡棍特工
25,6,Sorry sweaty-palmed fanboys - this is one of Tarantino's worst.,惡棍特工
26,5,What's worse than having to listen to 2 1/2 hours of Tarantino dialog?,惡棍特工
27,4,Christoph Waltz - an Oscar performance within a pile!,惡棍特工
28,8,A Rip Roaring Yarn,惡棍特工
29,1,More junk from Tarantino,惡棍特工
30,1,Inglourious Basterds waste of time film and my money,惡棍特工
31,10,Larger than life in the best cinematic ways,惡棍特工
32,2,Top 250!? Are you kidding me???????,惡棍特工
33,5,Frustrating Experience,惡棍特工
34,10,Brilliantly offbeat wartime western,惡棍特工
35,9,Waltz with Pitt,惡棍特工
36,7,The Jewish Scalphunters of Quentin Tarantino,惡棍特工
37,1,This one ain't DeathProof,惡棍特工
38,1,"Disaster Movie: probably the worst ""film"" I have ever seen....",惡棍特工
39,6,A Brilliant Filmmaker With Very Little To Say,惡棍特工
40,2,I really don't understand why people like this movie,惡棍特工
41,5,Very Boring!!!,惡棍特工
42,4,Where Tarantino fantasizes about dirty war in war,惡棍特工
43,1,"First of all, Pitt's accent ...",惡棍特工
44,1,Self indulgent and reliant on reputation,惡棍特工
45,1,Downhill since PF,惡棍特工
46,10,Tarantino Delivers!!!,惡棍特工
47,8,"Somewhat silly plot, but nevertheless quite good suspense and juicy acting performances.",惡棍特工
48,5,A mediocre effort from Tarantino. Nothing but a pastiche of films and silly sitcom dialog,惡棍特工
49,8,Business is a-Boomin',惡棍特工
50,1,Appalling,惡棍特工
51,9,Glorious indeed!,惡棍特工
52,5,Tarrantino shoots himself in the foot as 'Basterds' devolves into puerile wish fulfillment fantasy,惡棍特工
53,1,Utter $hite,惡棍特工
54,9,"Bold, brutal and brilliant.",惡棍特工
55,1,A waste of time and money,惡棍特工
56,1,A disgusting travesty,惡棍特工
57,1,Most overrated movie of the 21st Century,惡棍特工
58,1,Very disappointing,惡棍特工
59,6,"Slow and often stupid, but with some good acting",惡棍特工
60,10,Waltz is a Genius!!!!!,惡棍特工
61,9,Incredible.,惡棍特工
62,3,Rotting faeces masquerading as 'Tarentino Art',惡棍特工
63,1,Only in a sick society can a guy like Tarantino make any money.,惡棍特工
64,9,"I'm not a war film fan at all, but this is fantastic",惡棍特工
65,5,Abomination of a film,惡棍特工
66,1,I don't know WHAT this film was supposed to be,惡棍特工
67,10,Tarantino's best since Pulp Fiction - I absolutely loved it.,惡棍特工
68,1,In my opinion...awful,惡棍特工
69,8,"""We will be cruel to the Germans.""",惡棍特工
70,10,"Brave, unique and just sheer brilliant!",惡棍特工
71,4,Bring on the hate,惡棍特工
72,9,"Not quite great, but very good.",惡棍特工
73,7,"Witty, Quirky, Violent",惡棍特工
74,2,Basterdized Gloryholes,惡棍特工
75,4,Okay send up of the Euro-war film is for fans of Tarantino's dialog only,惡棍特工
76,10,a master popularizer at his very best,惡棍特工
77,9,Tarantino's War Movie,惡棍特工
78,1,Propaganda,惡棍特工
79,4,Typical Tarantino overwhelms World War II fantasy,惡棍特工
80,2,Is it possible to make a movie worse than this?,惡棍特工
81,3,When you lose your heart and soul as an artist....,惡棍特工
82,3,Not Very Glourious,惡棍特工
83,1,A True Homage to Stupidity!,惡棍特工
84,1,Another stinker from pain in the ass Quentin,惡棍特工
85,2,Childish yet boring,惡棍特工
86,1,Contemptible and awful beyond belief - America's descent into barbarism continues,惡棍特工
87,4,"Terrible movie, disappointed Tarantino fan",惡棍特工
88,7,Messy and indecisive,惡棍特工
89,1,Worst movie I've seen in a long time - AVOID IT AT ALL COSTS!!!,惡棍特工
90,9,dialogue language visuals homage to cinema,惡棍特工
91,1,What is the world coming to?!,惡棍特工
92,8,Another Masterpiece,惡棍特工
93,4,Fanboy directors fantasies---,惡棍特工
94,10,A bunch of haters rating it 1 star,惡棍特工
95,3,not worth the time - a HUGE disappointment,惡棍特工
96,4,Not so glorious violence,惡棍特工
97,5,Disappointing to the point of irritation,惡棍特工
98,1,Absolute garbage of the lowest order.,惡棍特工
99,6,Inglorious Letdown,惡棍特工
100,1,Would that be supposed to be an attempt to wake the sleepers in Metropolis?,惡棍特工
101,9,Tarantino Has Finally Made His Masterpiece,惡棍特工
102,3,Ridiculous cartoon strip movie,惡棍特工
103,1,"Not good enough to be satire, not bad enough to be good",惡棍特工
104,10,Not historically accurate- but that's ok!,惡棍特工
105,1,"offensive, propaganda and rewriting history",惡棍特工
106,10,What a damn movie,惡棍特工
107,9,Nobody Does Situations Like Tarantino,惡棍特工
108,9,Classic Tarantino,惡棍特工
109,10,Sublime!,惡棍特工
110,5,Tarantino's World War II movie - I don't get it.,惡棍特工
111,6,"A slight return to form for Tarantino, but there are still problems.",惡棍特工
112,10,Quentin Tarantino's best movie yet,惡棍特工
113,1,"""Nein,nein,nein,nein,nein"".....Adolf Hitler",惡棍特工
114,3,Unbelievable,惡棍特工
115,5,153 minutes of patches,惡棍特工
116,7,"He loves his movies, doesn't he?",惡棍特工
117,3,Absolute dogshit!,惡棍特工
118,1,Very ODD,惡棍特工
119,3,Applauding to violence,惡棍特工
120,2,This film does not entertain.,惡棍特工
121,9,Excellent,惡棍特工
122,3,Brad Pitt wins the war,惡棍特工
123,1,Train wreck of a movie,惡棍特工
124,1,Clear and Simple,惡棍特工
125,1,Hollywood's darkest hour this year.,惡棍特工
126,1,Worst American war movie ever made,惡棍特工
127,1,Nazis for Dummies,惡棍特工
128,8,Inglorious Basterds 2009 Review,惡棍特工
129,1,worse than the Nazis,惡棍特工
130,2,Carry On Killing,惡棍特工
131,6,WWII not an ideal backdrop for QT's masterful talents,惡棍特工
132,5,"I didn't like it and if you can overcome the hype, you might not, either.",惡棍特工
133,1,Another Tarantino Turkey,惡棍特工
134,9,Pains me to see reviews with 1 and 2 ratings.,惡棍特工
135,1,Tarantino laughs at his own fans,惡棍特工
136,9,Very good!,惡棍特工
137,3,"1 hour less would have been ""glourious""",惡棍特工
138,2,Purile rubbish,惡棍特工
139,1,One horrible movie,惡棍特工
140,4,you gotta be kidding me,惡棍特工
141,2,"Pale, poor and pretty stupid",惡棍特工
142,1,Not straight to DVD straight to betamax,惡棍特工
143,1,No plot - Just mindless violence and gore,惡棍特工
144,2,Tarantino redefines what a turkey might be: this is very bad.,惡棍特工
145,1,Tarantino's new low,惡棍特工
146,4,so so,惡棍特工
147,8,Inglorious Waltz,惡棍特工
148,5,Well made with a brilliant Christoph Waltz but uneven and disjointed,惡棍特工
149,1,Unbelievably Bad,惡棍特工
150,10,Tarantino at his best,惡棍特工
151,1,Beyond awful,惡棍特工
152,1,"""Inglourious"" (sic) Is Right!",惡棍特工
153,1,Nonsense,惡棍特工
154,2,He's finally gone completely mad...,惡棍特工
155,1,Puerile tripe,惡棍特工
156,3,Inglouriously overrated,惡棍特工
157,4,Another let down from the once great QT.,惡棍特工
158,1,Glorification of violence and unnecessary reanimation of old hostilities!,惡棍特工
159,10,Basically it's Tarantino's worst film!,惡棍特工
160,6,not so good,惡棍特工
161,2,Ridiculous,惡棍特工
162,1,Funny?,惡棍特工
163,1,Are we provoked yet or do we need more? Quentin Tarantino,惡棍特工
164,1,Complete nonsense,惡棍特工
165,1,"frankly, if it wasn't for Tarentino ...",惡棍特工
166,7,WTH? But in a good way,惡棍特工
167,2,I Must Have Missed A Meeting,惡棍特工
168,1,"Dear Mr. Tarantino, good film are not toys",惡棍特工
169,4,"Misfiring, self indulgent latest addition to the Tarantino staple",惡棍特工
170,2,A couple of great scenes and one great performance surrounded by indulgent nonsense,惡棍特工
171,4,"A long, sad and boring decadence",惡棍特工
172,5,Once upon a time in Tarantino's envisioned Nazi occupied France...,惡棍特工
173,1,A travesty riding on the (ill-gotten) reputation of a hack-director.,惡棍特工
174,1,Am I the only guy who hated Inglourious Basterds? Doubtful. This is Quentin Tarantino's WORST film!,惡棍特工
175,5,Excellent Performances Marred by Buffoonery,惡棍特工
176,2,Can't understand the hype - Brad Pitt in worst shape ever,惡棍特工
177,9,One of tarrintinos better films although has some issues,惡棍特工
178,9,One of the Best,惡棍特工
179,4,Pretty weak,惡棍特工
180,9,The only WWII film I enjoyed,惡棍特工
181,5,less than vintage Tarantino,惡棍特工
182,1,Who are the real Nazis? The allies or the 10 points raters?,惡棍特工
183,2,"Shallow, indulgent and pretentious",惡棍特工
184,2,Thoroughly dumb,惡棍特工
185,10,The actors are top notch and the carnage is just right.,惡棍特工
186,3,Wow bad,惡棍特工
187,10,My Favorite Tarantino Film,惡棍特工
188,1,The first IMDb disappointment ever,惡棍特工
189,5,"Nice try, Quentin, but absolutely no cigar!",惡棍特工
190,1,10 reasons why Inglourious Basterds sucks,惡棍特工
191,5,Inglorious is Right,惡棍特工
192,5,Rubbish apart from the brilliant acting,惡棍特工
193,2,Rotten movie,惡棍特工
194,10,The Glorious return of true cinematic excitement!,惡棍特工
195,10,Tarantino's Pride,惡棍特工
196,5,Torturous and good(?) Tarantino,惡棍特工
197,6,Fantasy Turned Into Un-Even Movie,惡棍特工
198,1,Very little Tarantino in between a lot of useless scenes,惡棍特工
199,2,Probably most overrated movie in this year!!!,惡棍特工
