,Rate,Review,Movie_name
0,10,Some birds aren't meant to be caged.,刺激1995
1,10,An incredible movie. One that lives with you.,刺激1995
2,10,Don't Rent Shawshank.,刺激1995
3,10,This is How Movies Should Be Made,刺激1995
4,10,A classic piece of unforgettable film-making.,刺激1995
5,10,"Enthralling, fantastic, intriguing, truly remarkable!",刺激1995
6,10,The Shawshank Redemption,刺激1995
7,10,Stephen King's best adapted movie,刺激1995
8,10,Eternal Hope,刺激1995
9,10,IMDb and the Greatest Film of All Time,刺激1995
10,10,All-time prison film classic,刺激1995
11,10,the shawshank redemption,刺激1995
12,10,"""I'm a convicted murderer who provides sound financial planning"".",刺激1995
13,10,"Simply known as ""The Movie""",刺激1995
14,10,Simply amazing. The best film of the 90's.,刺激1995
15,10,Shawshank Redeems Hollywood,刺激1995
16,9,"""I Had To Go To Prison To Learn To Be A Crook""",刺激1995
17,10,never give up hope,刺激1995
18,10,"The UNIVERSALITY of Shawshank: Andy Dufresne as ""EVERYMAN""",刺激1995
19,10,Hope can set you free and so can this remarkable film,刺激1995
20,9,A Sort of Secular Redemption,刺激1995
21,10,Shawshank Redemption- Prison Film is Redeemed by Quality ****,刺激1995
22,10,Simply the best,刺激1995
23,10,Powerful Masterpiece,刺激1995
24,10,Busy dying or busy living?,刺激1995
25,10,From my favorite movies..,刺激1995
26,8,The best story ever told on film,刺激1995
27,10,The closest thing to poetic perfection Hollywood has ever produced,刺激1995
28,9,I Know My Name Is Captain Obvious,刺激1995
29,10,Good for the spirit,刺激1995
30,8,Compensatory Incarceration...,刺激1995
31,10,The absolute GREATEST movie of all time.,刺激1995
32,8,"Great story, wondrously told and acted",刺激1995
33,10,A classic,刺激1995
34,10,The Greatest Movie of all Time,刺激1995
35,10,One of my favourites...,刺激1995
36,10,Masterpiece,刺激1995
37,9,An extraordinary and unforgettable film about a bank veep who is convicted of murders and sentenced to the toughest prison,刺激1995
38,10,Compelling masterpiece,刺激1995
39,10,"When There is Life, There is Hope; When There is Hope, There is Life",刺激1995
40,9,Delightful to sit through,刺激1995
41,10,"An astonishing tale of endurance, courage, life, and perspective..",刺激1995
42,10,Hope is everything,刺激1995
43,10,One of the most powerful movies I've ever watched,刺激1995
44,9,A Middle Finger To Pigs Everywhere,刺激1995
45,10,Best movie of all time!,刺激1995
46,10,life changing,刺激1995
47,10,"""I have to remind myself that some birds aren't meant to be caged""",刺激1995
48,10,Simply Wonderful,刺激1995
49,10,its an excellent piece of art,刺激1995
50,10,Why can't they make films like this anymore?,刺激1995
51,9,One of the Best If You Get It,刺激1995
52,10,i swear,刺激1995
53,10,Number two? Fine by me **** (out of ****),刺激1995
54,10,So amazing,刺激1995
55,10,Hope Springs Eternal:Rita Hayworth And The Shawshank Redemption.,刺激1995
56,10,Salvation lies within....,刺激1995
57,10,Redemption,刺激1995
58,10,Top Three Favorite Movies,刺激1995
59,10,"Richly human, uplifting",刺激1995
60,9,The Shawshank Redemption,刺激1995
61,10,Truly the greatest prison movie ever!,刺激1995
62,10,This is one of the most inspiring n one of the greatest film.,刺激1995
63,8,"Good , But It Is Overrated By Some",刺激1995
64,9,Near perfect,刺激1995
65,9,Now here is a classic,刺激1995
66,10,Classic,刺激1995
67,10,My #1,刺激1995
68,10,Better Late Then Never,刺激1995
69,9,"A bit overrated, but still an amazing film",刺激1995
70,10,Perfection!,刺激1995
71,10,mksl akteb review w elli t7t dah mosh bta3y,刺激1995
72,9,This Review Is Unneeded,刺激1995
73,9,A Popular Film That Deserves Its Popularity,刺激1995
74,10,The best film ever made!,刺激1995
75,10,A CLASSIC,刺激1995
76,9,Really good adapted screenplay but that's not enough to being the top rated movie of all time.,刺激1995
77,9,A Revolution in Storytelling,刺激1995
78,10,Beautiful movie,刺激1995
79,9,Fantastic Film,刺激1995
80,10,"A melodramatic, motherf***ing masterpiece",刺激1995
81,10,"#1 on IMDB's top 250, one of the best movies of all time and more than 6200 reviews... what's more to say about this movie?",刺激1995
82,10,Well Worth A Read.,刺激1995
83,7,"Good movie, but best of all time? Hardly . . .",刺激1995
84,10,Hope is a dangerous thing,刺激1995
85,10,I didn't think films could be this good....,刺激1995
86,9,10 out of 10,刺激1995
87,8,Outstanding,刺激1995
88,8,"Excellent Movie, But Not ""Greatest of All Time.""",刺激1995
89,7,Over Rated,刺激1995
90,9,Superb prison buddy story - but sadly unimportant film,刺激1995
91,10,Superb,刺激1995
92,10,Oh my godmother,刺激1995
93,8,Freeman gives it depth,刺激1995
94,7,Mystery,刺激1995
95,10,A Truly Uplifting Film,刺激1995
96,7,Stephen King's prison tale with a happy ending...,刺激1995
97,10,Shawshank Redemption Comes Out Clean,刺激1995
98,8,Emotionally Fulfilling,刺激1995
99,9,"When they give you life, that's what they take",刺激1995
100,10,Shamelessly uplifting; a heartfelt classic,刺激1995
101,10,Redemptive Masterpiece; Masterful Redemption,刺激1995
102,10,"A Powerful Story of Courage, Perseverance and Friendship ...",刺激1995
103,7,"Easy-breezy, obvious as a child's lie.",刺激1995
104,7,"A Bit Over-Rated Perhaps, But Still A Good Movie With Great Performances From Freeman and Robbins",刺激1995
105,10,"For hope, see it only.",刺激1995
106,8,Not that much good to get the rank 1,刺激1995
107,10,For Everyone who Gave This Movie a 1,刺激1995
108,7,Highly Overrated But Still Good,刺激1995
109,10,A favourite film,刺激1995
110,10,A movie to fuel one's life.,刺激1995
111,10,"Hope is a good thing, maybe the best of things.",刺激1995
112,10,You don't understand! I'm not supposed to be here!,刺激1995
113,8,Observations...,刺激1995
114,10,Redeeming.,刺激1995
115,9,A Story Of Hope & Resilence,刺激1995
116,9,"Reputation notwithstanding, this is powerful stuff",刺激1995
117,10,I can see why this is rated Number 1 on IMDb.,刺激1995
118,10,When And How Did The Movie Studios Forget How To Make Films Like This?,刺激1995
119,7,What's SO special?,刺激1995
120,10,One Of The Most Inspiring And Beautiful Movies Of All Time,刺激1995
121,10,The only time I'd call anything The Best Film Ever Made.,刺激1995
122,7,A bit overhyped,刺激1995
123,9,Who Or What Was Redeemed?,刺激1995
124,8,Not the greatest movie of all time but pretty darn good,刺激1995
125,10,A timeless masterpiece. A heart wrenching drama. An epic tale of true friendship.,刺激1995
126,10,One of the best movies ever made.,刺激1995
127,10,The greatest story of persistence pays off.,刺激1995
128,8,"If other people would rave about it less, I'd rave about it more",刺激1995
129,10,"Incredibly moving, funny and haunting",刺激1995
130,10,really superb,刺激1995
131,10,Masterpiece.,刺激1995
132,9,I dont care about it but its a good relaxing movie!,刺激1995
133,7,Undeservedly top 1,刺激1995
134,10,The best movie i ever watched,刺激1995
135,10,What a movie!!!,刺激1995
136,10,Best of all time!!!,刺激1995
137,9,One of the best - of all time. Seriously.,刺激1995
138,10,AN EXCELLENT MASTERPIECE !!,刺激1995
139,10,NOT just a prison movie,刺激1995
140,10,"Blatantly Simple, yet Utterly Beautiful",刺激1995
141,10,A true story of friendship and hard times,刺激1995
142,9,You'll get it when you see it.,刺激1995
143,3,Too flawed,刺激1995
144,10,best movie ever,刺激1995
145,3,I thought there were supposed to be no fairytales?,刺激1995
146,10,For When You Need to (Re)Watch A Good Movie,刺激1995
147,7,Why so high?,刺激1995
148,6,Escape from Shawshank,刺激1995
149,10,WYLION - Do you trust your wife? You can definitely trust me!,刺激1995
150,9,"Graceful, intriguing Tim Robbins triumph",刺激1995
151,9,Perfect,刺激1995
152,10,First 10 I have ever given out,刺激1995
153,10,I thought I'd discovered this movie,刺激1995
154,6,Overrated,刺激1995
155,3,"Sometimes, we all just don't agree.",刺激1995
156,7,"Very good, but probably over-praised",刺激1995
157,10,A Masterpiece,刺激1995
158,10,One of my TOP TEN,刺激1995
159,10,The Shawshank Redemption,刺激1995
160,3,"Not worth the hype, a script full of shortcuts",刺激1995
161,10,"If you haven't seen this movie, stop everything and watch it right now",刺激1995
162,8,Breaking Big Rocks Into Little Rocks,刺激1995
163,6,Good movie - Number 1 ??? No way,刺激1995
164,10,Perfectly written. Perfectly directed. Perfectly cast. Perfectly acted. Perfect,刺激1995
165,10,Don't Watch This Movie!! (Unless you want to Cry),刺激1995
166,8,The best film of all time ?,刺激1995
167,8,"A great film, but #2?",刺激1995
168,3,Morgan Freeman is the only great thing in this movie,刺激1995
169,10,My second favorite movie of all time,刺激1995
170,10,Absolutely brilliant,刺激1995
171,10,Greatness,刺激1995
172,3,Entertaining but still very much a piece of fiction,刺激1995
173,8,Meh? Only Joking!,刺激1995
174,10,One of the best movies I've ever seen,刺激1995
175,10,#2086,刺激1995
176,10,Decided to give it a try and..,刺激1995
177,10,One word. Outstanding.,刺激1995
178,10,Exceptional,刺激1995
179,8,Probably Not #1,刺激1995
180,4,"Overlong, Overblown and Over-rated",刺激1995
181,10,Best movie ever!!,刺激1995
182,10,An amazing tale of hope and patience,刺激1995
183,10,A prison drama starring Tim Robbins and Morgan Freeman.,刺激1995
184,10,nice,刺激1995
185,3,The Prison Of Storytelling,刺激1995
186,8,Highly Overrated But Only Good,刺激1995
187,10,"Review of ""The Shawshank Redemption""",刺激1995
188,10,"Prison thriller with violence, hatred, corruption, friendship and joy.",刺激1995
189,10,One of the best movies I have ever seen,刺激1995
190,3,absurdly overrated,刺激1995
191,10,Simply Perfect,刺激1995
192,10,Greatest movie of all time!,刺激1995
193,6,"A genre picture, but a satisfying one...",刺激1995
194,10,About a very very long escape from prison,刺激1995
195,10,I make the questions here!,刺激1995
196,6,"Reasonably good...but far too clichéd to be called ""great""",刺激1995
197,10,Magical film,刺激1995
198,10,A movie revolution upon all others,刺激1995
199,7,A cute and sentimental prison drama?,刺激1995
